source,address,url,rent_eur,summary,beds,baths,furnished
property.ie,"Fernleigh Grove, Castleknock, Dublin 15, Castleknock, Dublin 15",https://www.property.ie/property-to-let/Fernleigh-Grove-Castleknock-Dublin-15-Castleknock-Dublin-15/6454413/,3500,"4 bedrooms (4 double), 3 bathrooms, unfurnished Apartment to Rent",4,3,No
property.ie,"Mount Garrett Park, Tyrrelstown, Tallaght, Dublin 15, Tyrrelstown, Dublin 15",https://www.property.ie/property-to-let/Mount-Garrett-Park-Tyrrelstown-Tallaght-Dublin-15-Tyrrelstown-Dublin-15/6454412/,2288,"3 bedrooms (3 double), 3 bathrooms, unfurnished Apartment to Rent",3,3,No
property.ie,"Apartment 5, The Alders, Saint Edmunds Avenue, Lucan, Dublin 20",https://www.property.ie/property-to-let/Apartment-5-The-Alders-Saint-Edmunds-Avenue-Lucan-Dublin-20/6454358/,1974,"1 bedroom (1 double), 1 bathroom, furnished Apartment to Rent",1,1,Yes
property.ie,"Apt 90, Cedar Square, Ridgewood, K67 V883, Swords, Co. Dublin",https://www.property.ie/property-to-let/Apt-90-Cedar-Square-Ridgewood-K67-V883-Swords-Co-Dublin/6454363/,2350,"2 bedrooms (2 double), 1 bathroom, furnished Apartment to Rent",2,1,Yes
property.ie,"Apt 292, Argyle, Custom House Harbour Apartments, D01 F838, IFSC, Dublin 1",https://www.property.ie/property-to-let/Apt-292-Argyle-Custom-House-Harbour-Apartments-D01-F838-IFSC-Dublin-1/6454376/,2595,"2 bedrooms (2 double), 1 bathroom, furnished Apartment to Rent",2,1,Yes
property.ie,"Apartment, Fortlands, Merrion, Dublin 4",https://www.property.ie/property-to-let/Apartment-Fortlands-Merrion-Dublin-4/6454374/,2600,"2 bedrooms (2 double), 2 bathrooms, furnished Apartment to Rent",2,2,Yes
property.ie,"Phibsborough, North Circular Road, Dublin 7",https://www.property.ie/property-to-let/Phibsborough-North-Circular-Road-Dublin-7/6454336/,3600,"4 bedrooms (1 single, 3 double), 1 bathroom, furnished House to Rent",1,1,Yes
property.ie,"Apartment 306, Block 2c, Spencer Place Residential, IFSC, Dublin 1",https://www.property.ie/property-to-let/Apartment-306-Block-2c-Spencer-Place-Residential-IFSC-Dublin-1/6454256/,2295,Studio (1 single) Studio apartment to Rent,1,1,Unknown
property.ie,"Apartment 86, The Clayton, The Gasworks, Grand Canal Dock, Dublin 4",https://www.property.ie/property-to-let/Apartment-86-The-Clayton-The-Gasworks-Grand-Canal-Dock-Dublin-4/6452811/,2365,"2 bedrooms (2 double), 2 bathrooms, furnished Apartment to Rent",2,2,Yes
property.ie,"Prussia St, Stoneybatter, Dublin 7, Stoneybatter, Dublin 7",https://www.property.ie/property-to-let/Prussia-St-Stoneybatter-Dublin-7-Stoneybatter-Dublin-7/6454346/,6200,"5 bedrooms (5 double), 5 bathrooms, unfurnished House to Rent",5,5,No
property.ie,"29a Inbhir Ide, Malahide, Co. Dublin",https://www.property.ie/property-to-let/29a-Inbhir-Ide-Malahide-Co-Dublin/6454301/,2800,"4 bedrooms (1 single, 3 double), 2 bathrooms, unfurnished House to Rent",1,2,No
property.ie,"63 Waterside Court, Waterside, Malahide, Co. Dublin",https://www.property.ie/property-to-let/63-Waterside-Court-Waterside-Malahide-Co-Dublin/6454300/,2200,"1 bedroom (1 double), 1 bathroom, furnished Apartment to Rent",1,1,Yes
property.ie,"Apartment 1, 44 Cabra Park, Phibsborough, Dublin 7",https://www.property.ie/property-to-let/Apartment-1-44-Cabra-Park-Phibsborough-Dublin-7/6454228/,1850,"1 bedroom (1 double), 1 bathroom, furnished Apartment to Rent",1,1,Yes
property.ie,"Apartment 4, 25 Richmond Hill, Rathmines, Dublin 6",https://www.property.ie/property-to-let/Apartment-4-25-Richmond-Hill-Rathmines-Dublin-6/6454258/,1350,Studio (1 single) Studio apartment to Rent,1,1,Unknown
property.ie,"Apartment 2, 50 Castle Avenue, Clontarf, Dublin 3",https://www.property.ie/property-to-let/Apartment-2-50-Castle-Avenue-Clontarf-Dublin-3/6454251/,2250,"1 bedroom (1 double), 1 bathroom, furnished Apartment to Rent",1,1,Yes
property.ie,"6 Larkfield Dale, Clay Farm, Leopardstown, Dublin 18",https://www.property.ie/property-to-let/6-Larkfield-Dale-Clay-Farm-Leopardstown-Dublin-18/6454239/,3725,"3 bedrooms (3 double), 3 bathrooms, furnished House to Rent",3,3,Yes
property.ie,"Parklands, Northwood, Santry, Dublin 9, Santry, Dublin 9",https://www.property.ie/property-to-let/Parklands-Northwood-Santry-Dublin-9-Santry-Dublin-9/6454248/,2111,"2 bedrooms (2 double), 2 bathrooms, unfurnished Apartment to Rent",2,2,No
property.ie,"Dublin 24, Tallaght, Dublin 24",https://www.property.ie/property-to-let/Dublin-24-Tallaght-Dublin-24/6454101/,300,Studio (1 single) Studio apartment to Rent,1,1,Unknown
property.ie,"3 Fairways Park, Stillorgan Road, Foxrock, Dublin 18",https://www.property.ie/property-to-let/3-Fairways-Park-Stillorgan-Road-Foxrock-Dublin-18/6454098/,3500,"3 bedrooms (3 double), 2 bathrooms, furnished Apartment to Rent",3,2,Yes
property.ie,"Adelaide St, Dun Laoghaire, Co. Dublin",https://www.property.ie/property-to-let/Adelaide-St-Dun-Laoghaire-Co-Dublin/6448530/,1875,"1 bedroom (1 double), 1 bathroom, furnished Apartment to Rent",1,1,Yes
property.ie,"50 Lansdowne Park, Ballsbridge, Dublin 4",https://www.property.ie/property-to-let/50-Lansdowne-Park-Ballsbridge-Dublin-4/6450221/,3673,"2 bedrooms (2 double), 3 bathrooms, furnished House to Rent",2,3,Yes
property.ie,"Huntstown, Mulhuddart, Co. Dublin",https://www.property.ie/property-to-let/Huntstown-Mulhuddart-Co-Dublin/6454090/,1500,Studio (1 single) Studio apartment to Rent,1,1,Unknown
property.ie,"Bridge Water Quay, Conyngham Road, Kilmainham, Dublin 8",https://www.property.ie/property-to-let/Bridge-Water-Quay-Conyngham-Road-Kilmainham-Dublin-8/6453997/,4000,"3 bedrooms (3 double), 2 bathrooms, furnished House to Rent",3,2,Yes
property.ie,"11 Edenbrook Grove, Citywest, Dublin 24, Citywest, Co. Dublin",https://www.property.ie/property-to-let/11-Edenbrook-Grove-Citywest-Dublin-24-Citywest-Co-Dublin/6454066/,3000,"3 bedrooms (1 single, 2 double), 3 bathrooms, furnished House to Rent",1,3,Yes
property.ie,"14 Church Avenue South, Dublin 8, Rialto, Dublin 8",https://www.property.ie/property-to-let/14-Church-Avenue-South-Dublin-8-Rialto-Dublin-8/6454017/,3500,"3 bedrooms (3 double), 2 bathrooms, furnished House to Rent",3,2,Yes
property.ie,"Apartment 11, Weavers Hall, Levmoss Park, Leopardstown, Dublin 18",https://www.property.ie/property-to-let/Apartment-11-Weavers-Hall-Levmoss-Park-Leopardstown-Dublin-18/6454024/,2150,"1 bedroom (1 double), 1 bathroom, furnished Apartment to Rent",1,1,Yes
property.ie,"Apartment 4, 43 South Circular Road, Dublin 8",https://www.property.ie/property-to-let/Apartment-4-43-South-Circular-Road-Dublin-8/6454001/,2286,"2 bedrooms (2 double), 1 bathroom, furnished Apartment to Rent",2,1,Yes
property.ie,"Buckingham Street Upper, Dublin 1, North Circular Road, Dublin 1",https://www.property.ie/property-to-let/Buckingham-Street-Upper-Dublin-1-North-Circular-Road-Dublin-1/6453942/,2000,"1 bedroom (1 double), 1 bathroom, furnished Flat to Rent",1,1,Yes
property.ie,"Woodview, Kingswood Cross, Kingswood, Dublin 22",https://www.property.ie/property-to-let/Woodview-Kingswood-Cross-Kingswood-Dublin-22/6453943/,1369,"2 bedrooms (1 single, 1 double), 1 bathroom, furnished Flat to Rent",1,1,Yes
property.ie,"South Circular Road, Dolphin's Barn, Dublin 8",https://www.property.ie/property-to-let/South-Circular-Road-Dolphins-Barn-Dublin-8/6453995/,1450,Studio (1 single) Studio apartment to Rent,1,1,Unknown
property.ie,"Manders Terrace, Dublin 6, Ranelagh, Dublin 6",https://www.property.ie/property-to-let/Manders-Terrace-Dublin-6-Ranelagh-Dublin-6/6453956/,2282,"1 bedroom (1 double), 1 bathroom, furnished Apartment to Rent",1,1,Yes
property.ie,"Hayworth Drive, Ongar, Dublin 15, Ongar, Dublin 15",https://www.property.ie/property-to-let/Hayworth-Drive-Ongar-Dublin-15-Ongar-Dublin-15/6453968/,3045,"3 bedrooms (3 double), 3 bathrooms, unfurnished House to Rent",3,3,No
property.ie,"2 Swan Place, Upper Leeson Street, Donnybrook, Dublin 4",https://www.property.ie/property-to-let/2-Swan-Place-Upper-Leeson-Street-Donnybrook-Dublin-4/6438267/,2700,"2 bedrooms (2 double), 1 bathroom, furnished House to Rent",2,1,Yes
property.ie,"1 Bed, Merrion Road, Dublin 4",https://www.property.ie/property-to-let/1-Bed-Merrion-Road-Dublin-4/24078466/,3500,"1 bedroom (1 double), 1 bathroom, furnished Apartment to Rent",1,1,Yes
property.ie,"Thalassa, Ceanchor Road, Baily, Howth, Co. Dublin, Howth, Dublin 13",https://www.property.ie/property-to-let/Thalassa-Ceanchor-Road-Baily-Howth-Co-Dublin-Howth-Dublin-13/6453919/,9950,"4 bedrooms, 4 bathrooms, unfurnished House to Rent",4,4,No
property.ie,"Apartment 121, Ivy Exchange, Dublin 1",https://www.property.ie/property-to-let/Apartment-121-Ivy-Exchange-Dublin-1/6453790/,1900,"1 bedroom (1 double), 1 bathroom, furnished Apartment to Rent",1,1,Yes
property.ie,"Annadale Drive, Dublin 9, Marino, Dublin 3",https://www.property.ie/property-to-let/Annadale-Drive-Dublin-9-Marino-Dublin-3/6451112/,3000,"3 bedrooms (1 single, 2 double), 1 bathroom, furnished House to Rent",1,1,Yes
property.ie,"Suffolk Street, Dublin 2",https://www.property.ie/property-to-let/Suffolk-Street-Dublin-2/6453876/,2295,"1 bedroom (1 double), 1 bathroom, furnished Apartment to Rent",1,1,Yes
property.ie,"Glasaree Road, Finglas, Dublin 11",https://www.property.ie/property-to-let/Glasaree-Road-Finglas-Dublin-11/6453863/,5000,"5 bedrooms (1 single, 3 double, 1 twin), 2 bathrooms, furnished House to Rent",1,2,Yes
property.ie,"75 Merrion Village, Merrion Road, Merrion, Dublin 4",https://www.property.ie/property-to-let/75-Merrion-Village-Merrion-Road-Merrion-Dublin-4/6453822/,4500,"3 bedrooms (1 single, 2 double), 2 bathrooms, unfurnished House to Rent",1,2,No
property.ie,"Newtown Hall, Hazelbrook Square, Churchtown, Dublin 14",https://www.property.ie/property-to-let/Newtown-Hall-Hazelbrook-Square-Churchtown-Dublin-14/6453765/,1735,"1 bedroom (1 double), 1 bathroom, furnished Apartment to Rent",1,1,Yes
property.ie,"Credit Union Building, Rathcoole, Co. Dublin, Rathcoole, Co. Dublin",https://www.property.ie/property-to-let/Credit-Union-Building-Rathcoole-Co-Dublin-Rathcoole-Co-Dublin/6453774/,1650,"1 bedroom (1 double), 1 bathroom, unfurnished Apartment to Rent",1,1,No
property.ie,"3 Chancery Court, Chancery Lane, Dublin 2",https://www.property.ie/property-to-let/3-Chancery-Court-Chancery-Lane-Dublin-2/6451864/,2300,"2 bedrooms (1 single, 1 double), 1 bathroom, furnished Apartment to Rent",1,1,Yes
property.ie,"Corbally Way, Dublin 24, Citywest, Co. Dublin",https://www.property.ie/property-to-let/Corbally-Way-Dublin-24-Citywest-Co-Dublin/6452969/,1500,Studio (1 single) Studio apartment to Rent,1,1,Unknown
property.ie,"Corbally Way, Dublin 24, Citywest, Co. Dublin",https://www.property.ie/property-to-let/Corbally-Way-Dublin-24-Citywest-Co-Dublin/6452966/,4400,"5 bedrooms (5 double), 2 bathrooms, furnished House to Rent",5,2,Yes
property.ie,"Castleforbes Square, Dublin 1, IFSC, Dublin 1",https://www.property.ie/property-to-let/Castleforbes-Square-Dublin-1-IFSC-Dublin-1/6453685/,3500,"3 bedrooms (3 double), 2 bathrooms, furnished Apartment to Rent",3,2,Yes
property.ie,"Apartment 8, Rathmichael, The Crescent, Knocklyon, Dublin 16",https://www.property.ie/property-to-let/Apartment-8-Rathmichael-The-Crescent-Knocklyon-Dublin-16/6453618/,1936,"1 bedroom (1 double), 1 bathroom, furnished Apartment to Rent",1,1,Yes
property.ie,"Apartment 57, Rathmichael, The Crescent, Knocklyon, Dublin 16",https://www.property.ie/property-to-let/Apartment-57-Rathmichael-The-Crescent-Knocklyon-Dublin-16/6453646/,2371,"2 bedrooms (2 double), 2 bathrooms, furnished Apartment to Rent",2,2,Yes
property.ie,"Apartment 505, Block 2a, Spencer Place Residential, IFSC, Dublin 1",https://www.property.ie/property-to-let/Apartment-505-Block-2a-Spencer-Place-Residential-IFSC-Dublin-1/6453677/,2550,"1 bedroom (1 double), 1 bathroom, furnished Apartment to Rent",1,1,Yes
property.ie,"19 Stonebridge Wood, Dublin 18, Loughlinstown, Co. Dublin",https://www.property.ie/property-to-let/19-Stonebridge-Wood-Dublin-18-Loughlinstown-Co-Dublin/6453681/,3100,"3 bedrooms (3 double), 3 bathrooms, furnished Apartment to Rent",3,3,Yes
property.ie,"The Moorings, Portobello Harbour, Dublin 8, Portobello, Dublin 8",https://www.property.ie/property-to-let/The-Moorings-Portobello-Harbour-Dublin-8-Portobello-Dublin-8/6453670/,3200,"2 bedrooms (2 double), 3 bathrooms, furnished Apartment to Rent",2,3,Yes
property.ie,"44 Carlton Court, Swords, Swords, Co. Dublin",https://www.property.ie/property-to-let/44-Carlton-Court-Swords-Swords-Co-Dublin/6453616/,2950,"3 bedrooms (1 single, 2 double), 3 bathrooms, furnished or unfurnished House to Rent",1,3,No
property.ie,"Saint Lawrence Road, Dublin 3, Clontarf, Dublin 3",https://www.property.ie/property-to-let/Saint-Lawrence-Road-Dublin-3-Clontarf-Dublin-3/6453653/,1600,Studio (1 single) Studio apartment to Rent,1,1,Unknown
property.ie,"Rathmines Road Upper, Rathgar, Dublin 6",https://www.property.ie/property-to-let/Rathmines-Road-Upper-Rathgar-Dublin-6/6453614/,1500,Studio (1 single) Studio apartment to Rent,1,1,Unknown
property.ie,"Apartment 108, Block 9b, Tallaght Cross West, Tallaght, Dublin 24",https://www.property.ie/property-to-let/Apartment-108-Block-9b-Tallaght-Cross-West-Tallaght-Dublin-24/24078265/,2145,"2 bedrooms (2 double), 2 bathrooms, unfurnished Apartment to Rent",2,2,No
property.ie,"Apartment 103, Beacon One, Sandyford, Dublin 18",https://www.property.ie/property-to-let/Apartment-103-Beacon-One-Sandyford-Dublin-18/6453558/,2440,"2 bedrooms (2 double), 2 bathrooms, furnished Apartment to Rent",2,2,Yes
property.ie,"Woodview Court, Woodview, Lucan, Co. Dublin",https://www.property.ie/property-to-let/Woodview-Court-Woodview-Lucan-Co-Dublin/6453557/,2650,"2 bedrooms (2 double), 1 bathroom, furnished Apartment to Rent",2,1,Yes
property.ie,"Apartment 1, 59 Pembroke Lane, Dublin 2",https://www.property.ie/property-to-let/Apartment-1-59-Pembroke-Lane-Dublin-2/6453565/,2246,"1 bedroom (1 double), 1 bathroom, furnished Apartment to Rent",1,1,Yes
property.ie,"Eden House, Cabragh, Oldtown, Co. Dublin",https://www.property.ie/property-to-let/Eden-House-Cabragh-Oldtown-Co-Dublin/6453528/,2100,"2 bedrooms (1 single, 1 double), 1 bathroom, furnished or unfurnished Apartment to Rent",1,1,No
property.ie,"Apartment 10, 46 South Circular Road, Portobello, Dublin 8",https://www.property.ie/property-to-let/Apartment-10-46-South-Circular-Road-Portobello-Dublin-8/6453517/,1685,"1 bedroom (1 double), 1 bathroom, furnished Apartment to Rent",1,1,Yes
property.ie,"99 Ranelagh, Dublin 6, Ranelagh, Dublin 6",https://www.property.ie/property-to-let/99-Ranelagh-Dublin-6-Ranelagh-Dublin-6/6453416/,1200,Studio (1 single) Studio apartment to Rent,1,1,Unknown
property.ie,"Apartment 21, Brookwood Abbey, Artane, Dublin 5",https://www.property.ie/property-to-let/Apartment-21-Brookwood-Abbey-Artane-Dublin-5/6453346/,2203,"2 bedrooms (2 double), 2 bathrooms, furnished Apartment to Rent",2,2,Yes
property.ie,"Marino, Dublin 3, Marino, Dublin 3",https://www.property.ie/property-to-let/Marino-Dublin-3-Marino-Dublin-3/6443230/,3600,"3 bedrooms (1 single, 2 double), 2 bathrooms, furnished House to Rent",1,2,Yes
property.ie,"Frankfort Avenue, Rathgar, Dublin 6",https://www.property.ie/property-to-let/Frankfort-Avenue-Rathgar-Dublin-6/6453440/,1650,"1 bedroom (1 double), 1 bathroom, furnished Apartment to Rent",1,1,Yes
property.ie,"65 Fitzroy Avenue, Drumcondra, Dublin 3, Drumcondra, Dublin 3",https://www.property.ie/property-to-let/65-Fitzroy-Avenue-Drumcondra-Dublin-3-Drumcondra-Dublin-3/6453370/,3000,"3 bedrooms (1 single, 2 double), 2 bathrooms, furnished or unfurnished House to Rent",1,2,No
property.ie,"The Malthouse,marrowbone Lane,dublin 8, The Coombe, Dublin 8",https://www.property.ie/property-to-let/The-Malthousemarrowbone-Lanedublin-8-The-Coombe-Dublin-8/6453355/,1950,"1 bedroom (1 double), 1 bathroom, furnished Apartment to Rent",1,1,Yes
property.ie,"143 Merrion Road, Dublin 4",https://www.property.ie/property-to-let/143-Merrion-Road-Dublin-4/6453348/,4700,"3 bedrooms (3 double), 2 bathrooms, furnished Apartment to Rent",3,2,Yes
property.ie,"Apartment 3, Block B, Beechpark, Cabinteely, Dublin 18",https://www.property.ie/property-to-let/Apartment-3-Block-B-Beechpark-Cabinteely-Dublin-18/6453301/,2304,"2 bedrooms (2 double), 2 bathrooms, furnished Apartment to Rent",2,2,Yes
property.ie,"Ballsbridge Wood, Shelbourne Road, Ballsbridge, Dublin 4",https://www.property.ie/property-to-let/Ballsbridge-Wood-Shelbourne-Road-Ballsbridge-Dublin-4/6453298/,3700,"2 bedrooms (2 double), 2 bathrooms, furnished House to Rent",2,2,Yes
property.ie,"Buckingham Street Lower, Dublin 1, Dublin 1",https://www.property.ie/property-to-let/Buckingham-Street-Lower-Dublin-1-Dublin-1/6453274/,2400,"2 bedrooms (2 double), 1 bathroom, furnished Apartment to Rent",2,1,Yes
property.ie,"Greendale Road, Kilbarrack, Dublin 5, Kilbarrack, Dublin 5",https://www.property.ie/property-to-let/Greendale-Road-Kilbarrack-Dublin-5-Kilbarrack-Dublin-5/6453250/,3500,"4 bedrooms, 2 bathrooms, furnished House to Rent",4,2,Yes
property.ie,"Apartment 4, 16 Grove Park, Rathmines, Dublin 6",https://www.property.ie/property-to-let/Apartment-4-16-Grove-Park-Rathmines-Dublin-6/6453196/,1287,Studio (1 single) Studio apartment to Rent,1,1,Unknown
property.ie,"Taylor Hill Grange, Balbriggan, Balbriggan, Co. Dublin",https://www.property.ie/property-to-let/Taylor-Hill-Grange-Balbriggan-Balbriggan-Co-Dublin/6452856/,2650,"3 bedrooms (3 double), 3 bathrooms, furnished House to Rent",3,3,Yes
property.ie,"Apartment 15, Easra Court, Donnycarney, Dublin 5",https://www.property.ie/property-to-let/Apartment-15-Easra-Court-Donnycarney-Dublin-5/6453161/,2625,"2 bedrooms (2 double), 2 bathrooms, furnished Apartment to Rent",2,2,Yes
property.ie,"Apartment 63, Easra Court, Donnycarney, Dublin 5",https://www.property.ie/property-to-let/Apartment-63-Easra-Court-Donnycarney-Dublin-5/6453202/,2365,"1 bedroom (1 double), 1 bathroom, furnished Apartment to Rent",1,1,Yes
property.ie,"Apartment 6, 55 Rathmines Road Upper, Rathmines, Dublin 6",https://www.property.ie/property-to-let/Apartment-6-55-Rathmines-Road-Upper-Rathmines-Dublin-6/6453182/,1452,Studio (1 single) Studio apartment to Rent,1,1,Unknown
property.ie,"Oldbridge Glen, Lucan, Co. Dublin, Lucan, Co. Dublin",https://www.property.ie/property-to-let/Oldbridge-Glen-Lucan-Co-Dublin-Lucan-Co-Dublin/6453178/,3500,"4 bedrooms (4 double), 2 bathrooms, unfurnished House to Rent",4,2,No
property.ie,"Apartment 62, Temple Gardens, Northwood, Dublin 9, Dublin 9",https://www.property.ie/property-to-let/Apartment-62-Temple-Gardens-Northwood-Dublin-9-Dublin-9/6451793/,2500,"2 bedrooms (2 double), 2 bathrooms, furnished or unfurnished Apartment to Rent",2,2,No
property.ie,"Muckross Avenue, Perrystown, Dublin 12",https://www.property.ie/property-to-let/Muckross-Avenue-Perrystown-Dublin-12/6453157/,1960,"1 bedroom (1 double), 1 bathroom, furnished Apartment to Rent",1,1,Yes
property.ie,"New Priory, Clongriffin, Dublin 13, Clongriffin, Dublin 13",https://www.property.ie/property-to-let/New-Priory-Clongriffin-Dublin-13-Clongriffin-Dublin-13/6453136/,2800,"2 bedrooms (2 double), 2 bathrooms, unfurnished Apartment to Rent",2,2,No
property.ie,"Red Arches Road, The Coast, Baldoyle, Dublin 13, Baldoyle, Dublin 13",https://www.property.ie/property-to-let/Red-Arches-Road-The-Coast-Baldoyle-Dublin-13-Baldoyle-Dublin-13/6453135/,2380,"3 bedrooms (3 double), 2 bathrooms, unfurnished House to Rent",3,2,No
property.ie,"30 Larkfield Way, Leopardstown, Dublin 18",https://www.property.ie/property-to-let/30-Larkfield-Way-Leopardstown-Dublin-18/24078006/,3931,"4 bedrooms, 4 bathrooms, unfurnished House to Rent",4,4,No
property.ie,"The Orchard, Cherryfield Avenue Upper, Milltown, Dublin 6",https://www.property.ie/property-to-let/The-Orchard-Cherryfield-Avenue-Upper-Milltown-Dublin-6/6453052/,7000,"4 bedrooms (4 double), 2 bathrooms, furnished House to Rent",4,2,Yes
property.ie,"Apt 408, The Cubes 1, Beacon South Quarter, D18 Ew90, Sandyford, Dublin 18",https://www.property.ie/property-to-let/Apt-408-The-Cubes-1-Beacon-South-Quarter-D18-Ew90-Sandyford-Dublin-18/6453078/,2500,"2 bedrooms (2 double), 2 bathrooms, furnished Apartment to Rent",2,2,Yes
property.ie,"Apt 5, Block 1, Parklands, D09cc9c, Santry, Dublin 9",https://www.property.ie/property-to-let/Apt-5-Block-1-Parklands-D09cc9c-Santry-Dublin-9/6453071/,1850,"1 bedroom (1 double), 2 bathrooms, furnished Apartment to Rent",1,2,Yes
property.ie,"Apt 12, Fernley Court, D08 CK09, Dublin 8",https://www.property.ie/property-to-let/Apt-12-Fernley-Court-D08-CK09-Dublin-8/6453069/,2550,"2 bedrooms (2 double), 2 bathrooms, furnished Apartment to Rent",2,2,Yes
property.ie,"Apt 159, Block C, Lymewood Mews, Northwood, D09 A308, Santry, Dublin 9",https://www.property.ie/property-to-let/Apt-159-Block-C-Lymewood-Mews-Northwood-D09-A308-Santry-Dublin-9/6453065/,2500,"2 bedrooms (2 double), 2 bathrooms, furnished Apartment to Rent",2,2,Yes
property.ie,"Apt 42, Block 3, Parklands, Northwood, D09 C671, Santry, Dublin 9",https://www.property.ie/property-to-let/Apt-42-Block-3-Parklands-Northwood-D09-C671-Santry-Dublin-9/6453063/,2500,"2 bedrooms (2 double), 2 bathrooms, furnished Apartment to Rent",2,2,Yes
property.ie,"Ballyneety Road, Ballyfermot, Dublin 10",https://www.property.ie/property-to-let/Ballyneety-Road-Ballyfermot-Dublin-10/6453007/,2008,"2 bedrooms (2 double), 2 bathrooms, furnished House to Rent",2,2,Yes
property.ie,"North Frederick Court, 9 Frederick Lane North, Dublin 1, Dublin 1",https://www.property.ie/property-to-let/North-Frederick-Court-9-Frederick-Lane-North-Dublin-1-Dublin-1/6452995/,3600,"3 bedrooms (3 double), 2 bathrooms, unfurnished Apartment to Rent",3,2,No
property.ie,"Walsh Road, Dublin 9, Drumcondra, Dublin 9",https://www.property.ie/property-to-let/Walsh-Road-Dublin-9-Drumcondra-Dublin-9/6452986/,1150,Studio (1 single) Studio apartment to Rent,1,1,Unknown
property.ie,"Flat 3, 179 Clonliffe Road, Ballybough, Dublin 3",https://www.property.ie/property-to-let/Flat-3-179-Clonliffe-Road-Ballybough-Dublin-3/6452982/,1695,Studio (1 single) Studio apartment to Rent,1,1,Unknown
property.ie,"Custom House Harbour, IFSC, Dublin 1",https://www.property.ie/property-to-let/Custom-House-Harbour-IFSC-Dublin-1/6452978/,2600,"2 bedrooms (2 double), 1 bathroom, furnished Apartment to Rent",2,1,Yes
property.ie,"Monalea Wood, Dublin 24, Firhouse, Dublin 24",https://www.property.ie/property-to-let/Monalea-Wood-Dublin-24-Firhouse-Dublin-24/6452845/,4950,"4 bedrooms (4 double), 4 bathrooms, furnished House to Rent",4,4,Yes
property.ie,"Apartment 716, Longboat Quay North Apartments, Grand Canal Dock, Dublin 2",https://www.property.ie/property-to-let/Apartment-716-Longboat-Quay-North-Apartments-Grand-Canal-Dock-Dublin-2/6452900/,3200,"2 bedrooms (2 double), 2 bathrooms, unfurnished Apartment to Rent",2,2,No
property.ie,"Kiltipper Gate, Tallaght, Dublin 24, Aylesbury, Dublin 24",https://www.property.ie/property-to-let/Kiltipper-Gate-Tallaght-Dublin-24-Aylesbury-Dublin-24/6452972/,2066,"2 bedrooms (2 double), 2 bathrooms, unfurnished Apartment to Rent",2,2,No
property.ie,"Apartment 3, 57 Bath Avenue, Sandymount, Dublin 4",https://www.property.ie/property-to-let/Apartment-3-57-Bath-Avenue-Sandymount-Dublin-4/6452950/,2300,"1 bedroom (1 double), 1 bathroom, furnished Apartment to Rent",1,1,Yes
property.ie,"Castleforbes Square,dublin 1, IFSC, Dublin 1",https://www.property.ie/property-to-let/Castleforbes-Squaredublin-1-IFSC-Dublin-1/6452934/,2600,"2 bedrooms (2 double), 2 bathrooms, furnished Apartment to Rent",2,2,Yes
property.ie,"Gardiner Street Upper, Dublin 1",https://www.property.ie/property-to-let/Gardiner-Street-Upper-Dublin-1/6452890/,1850,"1 bedroom (1 double), 1 bathroom, furnished Flat to Rent",1,1,Yes
property.ie,"64 Tolka Road, Dublin 3, Ballybough, Dublin 3",https://www.property.ie/property-to-let/64-Tolka-Road-Dublin-3-Ballybough-Dublin-3/6452886/,3600,"3 bedrooms (1 single, 2 double), 1 bathroom, furnished House to Rent",1,1,Yes
property.ie,"Blessington Street, Dublin 7",https://www.property.ie/property-to-let/Blessington-Street-Dublin-7/6452902/,1700,"1 bedroom (1 double), 1 bathroom, furnished Apartment to Rent",1,1,Yes
property.ie,"Apartment 18, Milton Hall, Swords, Co. Dublin",https://www.property.ie/property-to-let/Apartment-18-Milton-Hall-Swords-Co-Dublin/6452849/,2500,"2 bedrooms (2 double), 1 bathroom, furnished Apartment to Rent",2,1,Yes
property.ie,"82 Cherrywood, Loughlinstown, Glenageary, Co. Dubl, Cherrywood, Co. Dublin",https://www.property.ie/property-to-let/82-Cherrywood-Loughlinstown-Glenageary-Co-Dubl-Cherrywood-Co-Dublin/6452679/,3000,"4 bedrooms (2 single, 2 double), 2 bathrooms, furnished House to Rent",2,2,Yes
property.ie,"Millstone House, Old Nangor Road, Clondalkin, Dublin 22, Clondalkin, Dublin 22",https://www.property.ie/property-to-let/Millstone-House-Old-Nangor-Road-Clondalkin-Dublin-22-Clondalkin-Dublin-22/6452465/,1645,"1 bedroom (1 double), 1 bathroom, unfurnished Apartment to Rent",1,1,No
property.ie,"Flat 2, 1 Berkeley Street, Dublin 7, North Circular Road, Dublin 7",https://www.property.ie/property-to-let/Flat-2-1-Berkeley-Street-Dublin-7-North-Circular-Road-Dublin-7/6451124/,2000,"1 bedroom (1 double), 1 bathroom, furnished Apartment to Rent",1,1,Yes
property.ie,"The Oaks, Rockford Manor, Stradbrook Road, Monkstown, Co. Dublin",https://www.property.ie/property-to-let/The-Oaks-Rockford-Manor-Stradbrook-Road-Monkstown-Co-Dublin/6452836/,2900,"2 bedrooms (2 double), 2 bathrooms, furnished Apartment to Rent",2,2,Yes
property.ie,"Turnstone, Barnageeragh Cove, Skerries, Co. Dublin",https://www.property.ie/property-to-let/Turnstone-Barnageeragh-Cove-Skerries-Co-Dublin/6452808/,2500,"3 bedrooms (3 double), 3 bathrooms, furnished or unfurnished Apartment to Rent",3,3,No
property.ie,"Buckingham Street Upper, Dublin 1",https://www.property.ie/property-to-let/Buckingham-Street-Upper-Dublin-1/6452833/,2000,"1 bedroom (1 double), 1 bathroom, furnished Apartment to Rent",1,1,Yes
